Row ID;TCMBank_ID;TCM_name;TCM_name_en;Herb_pinyin_name;Herb_latin_name;Properties;Meridian 1;Meridian 2;Meridian 3;Meridian 4;Meridian 5;Meridian 6;UsePart;Function;Indication;Toxicity;Clinical_manifestations;Therapeutic_en_class;Therapeutic_cn_class;TCM_ID_id;TCMSP_id;Herb_ID
324;TCMBANKHE004691;"缩砂仁; 砂仁";Villous Amomum Fruit;"SUO SHA REN; SHA REN";Fructus Amomi;"Warm; Pungent";Spleen; Stomach; Kidney;;;;"Amomum villosum Lour.; ripe fruit or seed";"Treatment of accumulation of damp in the spleen and the stomach marked by epigastric stuffieness and anorexia, vomiting and diarrhea in deficiency cold syndrome of the spleen and the stomach, pernicious vomiting of pregnancy, threatened abortion.; To eliminate damp and improve appetite, to warm the spleen and check diarrhea, and to prevent abortion.";"1. Its decoction lower thab 1% concentration stimulates and that higher than 1% or the saturated solution of its volatile oil inhibits the intestines of guinea-pigs in vitro.2. Its volatile oil acts as stomachic tonic and exaggerates the diacharge of flatus.; Abdominal pain glomus distention, food stagnation in torpid stomach, dysphagia-occlusion, vomiting, cold dysentery, stirring fetus in pregnancy.";;1. Its decoction lower thab 1% concentration stimulates and that higher than 1% or the saturated solution of its volatile oil inhibits the intestines of guinea-pigs in vitro.2. Its volatile oil acts as stomachic tonic and exaggerates the diacharge of flat;"For desolving dampness by flavors; Dampness Removing Drugs";芳香化湿;"3795; 3244";"679; 614";"HERB005337; HERB004853"
325;TCMBANKHE004697;甘遂;"root of Gansui; Kansui Euphorbia; Euphorbia kansui";GAN SUI;Radix Kansui;"Cold; Bitter";Lung; Large Intestine; Kidney;;;;tuberoid;To cause drastic purgation and expel the retained water.;Edema, ascites, flowing rheum in chest, concretion conglomeration accumulation and gathering, epilepsy, cough and asthma, urinar y and fecal stoppage.;;1. Purgative effect on mice by both fresh and prepared products but the latter bing more potent.2. Kansuinine A abd B are analgesic.;Drastic Purgatives;通水药;3336;266;HERB001806
326;TCMBANKHE004707;赤芍;"Red Peony root; Common Peony (wild); Radix Paeoniae Rubra";"CHI SHAO; LIGNUM PAEONIAE RUBRA";"Radix Paeoniae Rubra; Lignum Paeoniae Rubra";"Minor cold; Bitter";Liver;;;;;;;To remove heat from blood, to eliminate blood stasis, and to relieve pain.;1. Paeoniflorin, one of its active components, has a strong antispastic effect and also analgesic, sedative, anticonvulsive, antibacterial and anti-imflammatory effects. 2. Dilating blood vessels, increasing coronary flow and improving myocardial oxygen supply. 3. Inhibiting platelets aggregation.;;1. Paeoniflorin, one of its active components, has a strong antispastic effect and also analgesic, sedative, anticonvulsive, antibacterial and anti-imflammatory effects. 2. Dilating blood vessels, increasing coronary flow and improving myocardial oxygen s;Heat Clearing Blood Cooling Drugs;清热凉血药;"1957; 6926";"100; 455";"HERB000800; HERB003416"
327;TCMBANKHE004755;急性子;"seed of Garden Balsam; Garden Balsam Seed";JI XING ZI;Semen Impatientis;"Pungent; Bitter";Liver; Heart;;;;;ripe seed;To remove stagnation of qi, eliminate blood stasis, and soften hard masses.;Concretion and conglomeration, lump glomus, amenorrhea, dysphagia-occlusion.;Toxic;;Blood Activating Stasis Removing Drugs;活血祛瘀药;7644;382;HERB002711
328;TCMBANKHE004757;蛇床子;"Common Cnidium Fruit; Cnidium monnieri; Common Cnidium";SHE CHUANG ZI;Fructus Cnidii;"Warm; Pungent; Bitter";Kidney;;;;;;fruit;To warm the kidney and promote virility, to remove damp, to dispel zvind, and to kill parasites.;Impotence, scrotal damp itch, vaginal discharge, pudendal itch, trichomoniasis, eczema, infertility due to uterus cold, wind-damp impediment pain, scab and lichen, damp sore.;;1. Its alcoholic extract exerts a gonadotropic effect, I.e., prolong estruation, increase the weight of ovary and uterus in female mice and that of prostate, seminal vesicle and musculi levator ani in male mice. 2. Relieving cyclophosphamide-induced leuko;Medicinal For Detoxification、Parasiticide、Drying Dampness And Relieving Itching;解毒杀虫燥湿止痒药;7399;628;HERB004971
329;TCMBANKHE004762;熊胆;"Bear Gall; Ursus arctos Linnaeus and Selenarctos thibetanus";XIONG DAN;Selenarctos thibetanus, Ursus arctos;"Cold; Bitter";Liver; Heart; Gallbladder;;;;gall bladder;To clear heat and resolve toxin, calm liver and brighten eyes, stanch bleeding and kill worms.;Fright wind, epilepsy, convulsion due to liver heat and liver wind, swollen pain in red eyes due to liver heat, aversion to light, eye screen, swelling pain of welling abscess and sore, swelling pain from hemorrhoids.;;;Heat clearence;清热;3888;773;HERB006240
330;TCMBANKHE004773;凤尾草;"all - grass of Chinese Brake; Chinese Brake";FENG WEI CAO;Herba Pteridis multifidae;"Cold; Bitter; Neutral";Large Intestine; Stomach; Liver; Kidney;;;whole herb or rhizome;1. To clear heat and toxic material. 2. To cool the blood and stop bleeding.;Dysentery, diarrhea, strangury-turbidity, vaginal discharge, jaundice, swelling toxin of clove sore, throat impediment with nipple moth, scrofula, parotitis, mastitis, ardent fever and convulsion, snake or insect bites, blood ejection, spontaneous external bleeding, hematuria, hematochezia, bleeding due to external injury.;;Bacteriostatic effect on Bacillus dysenteriae. ;Antipyretic Detoxicate Drugs;清热解毒药;5673;245;HERB001713
331;TCMBANKHE004777;胡荽;"Coriander; Coriandrum sativum L.";HU SUI;Herba Coriandri;"Pungent; warm";Lung; stomach;;;;;Coriandrom saticum L.;Treatment of early stage of measles due to attack of wind and cold manifested as fever, no sweating and measles without a rash. Coriander (Husui) is used with Spirodela (Fuping) and Cimicifuga rhizome (Shengma). The heated herbal tea is applied to the skin to bring the rash to the surface.;Treatment of early stage of measles due to attack of wind and cold manifested as fever, no sweating and measles without a rash. Coriander (Husui) is used with Spirodela (Fuping) and Cimicifuga rhizome (Shengma). The heated herbal tea is applied to the ski;;;For relieving exterior syndrome;解表;5192;968;HERB002390
332;TCMBANKHE004791;浮萍;"all-grass of Common Ducksmeat; Common Duckwood; Spirodela polyrrhiza";FU PING;Herba Spirodelae;"Cold; Pungent";Lung; Bladder;;;;;whole herb;To dispel wind-heat, to promote eruption, and to cause diuresis.;Wind-heat exterior syndrome, non-eruption of measles, dormant papules with pruritus, edema, dribbling urinary block, sore and lichen, erysipelas, scalds.;;1. Containing potassium acetate and chloride which exert diuretic effect.2. Orall adminstration of its decoction or infusion (2g/kg) can reduce vaccine-induced fever in rabbits.3. Cardiotonic on the heart of frog weakened by quinine. Also causing constric;Pungent Cool Diaphoretics;辛凉解表药;3768;254;HERB001758
333;TCMBANKHE004803;茜草;"root of Tali Madder; Madder";QIAN CAO;Radix Rubiae;"Cold; Bitter";Liver;;;;;;;To remove heat from blood and arrest bleeding, to eliminate blood stasis, and to stimulate menstrual discharge.;1. Hemostatic. 2. Bacteriostatic in vitro. 3. Antitussive and expectorant.;;1. Hemostatic. 2. Bacteriostatic in vitro. 3. Antitussive and expectorant. ;Stasis-Resolving Hemostatic Medicinal;化瘀止血药;3696;561;HERB004446
334;TCMBANKHE004813;益智仁;"Sharpleaf Galangal; Alpinia oxyphylla";YI ZHI REN;Alpinia oxyphylla;"Warm; Pungent";Spleen; Kidney;;;;;fruit;To warm spleen, check diarrhea, warm kidney, reduce urine, secure essence.;Spleen-stomach vacuity cold, vomiting and diarrhea, cold pain in abdomen, drooling, enuresis due to kidney vacuity, frequent urination, emission, white turbidity.;;1. Relieving the cyclophosphamide-induced leucopenia in mice.2. Inhibiting the biosynthesis of prostaglandin.;For tonifying weakness;补虚;7655;803;HERB006572
335;TCMBANKHE004816;"禹粮石; 禹余粮";Limonite;"YU LIANG SHI; YU YU LIANG";Limonitum;"Mild; Sweet; Punkery";Spleen; Large Intestine; Stomach;;;;;Treatment of chronic diarrhea, chronic dysentery, abnormal uterine bleeding, morbid leukorrhea.;Treatment of chronic diarrhea, chronic dysentery, abnormal uterine bleeding, morbid leukorrhea.;;;Astriction;收涩;"8006; 5784";"814; 1078";"HERB006726; HERB006750"
336;TCMBANKHE004838;山豆根;"Vietmese Sophora Root;Sophora tonkinensis;Tonkin Sophora  Root ";SHAN DOU GEN;Radix Sophorae Tonkinensis;"Cold; Bitter";Lung; Stomach;;;;;root and rhizome;To remove toxic heat, promote the subsidence of swelling, and soothe the sore throat.;Septicemia, ulcer of uterine cervix, chronic cervicitis, bacillary dysentery, enteritis, hydatid moles, chorioblastoma, asthma, chronic bronchitis, acute tonsillitis, laryngitis, accumulated fire toxin, swelling pain in throat, gingiva painful swelling.;;1. Antineoplastic. Matrine, an active component, in anticarcinogenic on ascitic carcinoma in mice in vitro and in vivo. Other action components, oxymatrine, sophoraponicin, pterorepine, trifolirhizin and maackian, are anticarcinogenic on sarcoma180 in mic;Antipyretic Detoxicate Drugs;清热解毒药;1419;618;HERB004883
337;TCMBANKHE004843;鹿茸;Hairy Antler;LU RONG;Cervus nippon , Cervus elaphus;"Warm; Sweet; Salty";Liver; Kidney;;;;;non-ossifying young horn of male deer or stag;To supplement kidney and invigorate yang , boost essence and blood, strengthen sinews and bones, regulate thoroughfare and controlling vessels, draw sore toxin.;Impotence and emission, infertility due to uterus cold, marked emaciation, thrombocytopenia, septicemia, fatigued spirit, aversion of cold, dizziness, tinnitus and deafness, aching pain in lumbus and back, limp wilting sinew and bone, flooding and spotting with vaginal discharge, enduring yin flat abscess.;;1. It is a tonic, promoting gastrointestinal peristalsis, accelerating the healing of ulcer or wound, and increasing the level of red blood cell, hemoglobin and reticulocyte.2. Increasing myocardial contractility, heart rate and cardic output.3. Its tinct;For tonifying weakness;补虚;4063;479;HERB003536
338;TCMBANKHE004862;降香;"Odoriferous Rosewood;Dalbergia";JIANG XIANG;Lignum Dalbergiae odoriferae Rosewood;"Warm; Pungent";Spleen; Liver;;;;;;To relieve pain by promoting the circulation of qi and blood, and to arrest bleeding.;Shortening the plasma recalcification time in rabbits.;;Shortening the plasma recalcification time in rabbits.;Qi Regulating Drugs;理气药;7370;391;HERB002846
339;TCMBANKHE004879;鸡冠花;Cockscomb flower ;JI GUAN HUA;Flos Celosiae cristatae;"Cool; Sweet";Large Intestine; Liver;;;;;inflorescence;To arrest discharge.;Bleeding, vaginal discharge, diarrhea, dysentery.;; As an astringent.;Astringent Hemostatic Medicinal;收敛止血药;2852;379;HERB002667
340;TCMBANKHE004912;丁香;Clove;DING XIANG;Flos Caryophylli;"Warm; Pungent";Spleen; Stomach; Kidney;;;;flower bud;To warm the spleen and stomach, to regulate the adverse flow of the stomach qi, and to restore the kidney yang.;Stomach cold with retching counterflow, hiccough, cold pain in stomach duct and abdomen, reduced food intake and diarrhea, kidney vacuity impotence, vacuity cold in lumbus and knees, yin flat abscess.;;1. Causing hyperemia of gastic mucisa, increasing secretion of gastric fluid and promoting appetite by oral administration.2. Bacteriostatic.3. Its volatile oil can relieve toothache caused by dental caries.4. Its decoction or alcoholic extract can paraly;Warming Interior Drugs;温里药;5374;220;HERB001309
341;TCMBANKHE004916;浙贝母;"bulb of Thunberg Fritillary;Thunberg  Fritillary";ZHE BEI MU;Bulbus Fritillariae thunbergii;"Cold; Bitter";Lung; Heart;;;;;bulb;To remove heat and resolve phlegm, to ease the mind, and to reduce modulation.;Chronic bronchitis, infection of upper respiratory tract, tuberculosis, gastric ulcer, duodenal ulcer, externally contracted wind-heat, phlegm fire cough, pulmonary welling abscess, mammary welling abscess, scrofula, sore toxin, depression in heart-chest.;;Intraperitioneal administration of its active components, peumine or peiminine, exerts a significant antitussive effect in mice.;Phlegresolving Medicine;化痰药;5615;178;HERB006950
342;TCMBANKHE004917;草贝母;Indian Iphigenia;CAO BEI MU;Iphigenia indica;"Warm; Bitter";Lung; Spleen; Stomach; Liver;;;bulb;To dissipate binds and relieve pain.;Carcinoma of mammary glands, nasopharyngeal carcinoma, carcinoma of salivary gland, scrofula, swelling of skin, pain wind.;Extremely Toxic;;For desolving phlegm, stopping cougth, and soothing breathing;化痰止咳平喘;5654;72;HERB000586
343;TCMBANKHE004921;茅根;Japanese Buttercup;MAO GEN;Ranunculus japonicus;"Cold; Sweet";Lung; Bladder; Stomach;;;;whole herb and root;To abate jaundice, settle asthma, interrupt malaria, settle pain, eliminate screen.;Malaria, jaundice, migraine, stomachache, pain in joints due to rheumatalgia, crane’s knee wind, swollen welling abscess, malign sore, scab and lichen, toothache, fire eye.;;;;止血;6595;507;HERB003766
344;TCMBANKHE004946;白花蛇舌草;"all - grass of Spreading Hedyotis;Oldenlandia diffusa";BAI HUA SHE SHE CAO;Herba Hedyotis Diffusae;"Cold; Sweet; Slightly Bitter";Large Intestine; Stomach; Small Intestine;;;;whole herb with root;1. To eliminate heat and toxic material, promote blood circulation and remove blood stasis. 2. To clear dampness-heat.;Lung heat cough asthma, swelling pain in throat, intestinal welling abscess, swelling of sores and boils, poisonous snake bite, heat strangury with inhibited pain, edema, dysentery, enteritis, damp-heat jaundice, carcinoma.;;1. Its components coumarins, triterpenes, polysaccharide and (B)-sitosterol inhibit the growth of sarcoma180 and cervix carcinoma14 in vitro.2. Promoting white cell phagocytosis and humoral immunity.;Antipyretic Detoxicate Drugs;清热解毒药;6341;22;HERB000208
345;TCMBANKHE004953;青木香;"Slender Dutchmanspipe Root Equivalent plant: Aristolochia contorta;Slender Dutchmanspipe Root Equivalent plant: Arist;Slender Dutchmanspipe Root";QING MU XIANG;Aristolochia debilis [Syn. Aristolochia longa ];"Cold; Pungent; Bitter";Stomach; Liver;;;;;root;To lower blood pressure, calm liver and relieve pain, resolve toxin and disperse swelling.;Hypertension, gastrospasm, stomachache, infections, chronic bone marrow infection, chronic bronchitis, infection of skin, dizziness and headache, distending pain in chest and abdomen, swollen welling abscess and clove sores, snake or insect bites.;;;Regulation of qi;理气;3611;584;HERB004531
346;TCMBANKHE004972;苏木;Sappan Caesalpinia;SU MU;Caesalpinia sappan;"Mild; Pungent; Sweet; Salty";Spleen; Liver; Heart;;;;heartwood;To quicken blood and dispel stasis, disperse swelling and relieve pain.;Amenorrhea and dysmenorrhea, postpartum blood stasis, stabbing pain in chest and abdomen, swelling pain due to external injury.;;;Blood activation and stasis removal;活血化淤;4597;673;HERB005297
347;TCMBANKHE004973;麻黄;"Ephedra;Herba Ephedrae";MA HUANG;Herba Ephedrae;"Warm; Pungent; Slightly Bitter";Lung; Bladder;;;;;herbaceous twigs;To induce perspiration for dispelling cold, to relieve asthma, and to cause diuresis.;Wind-cold exterior repletion syndrome, headache without sweating, headache and generalized pain, cough, fever, fever and aversion to wind, absence of sweating, congesting lung, non-diffusion of lung qi, cough and asthma, bronchial asthma, wind water edema, nasal congestion, allergic rhinitis, inhibited urination, wind-damp impediment pain, muscle numbness, wind papule itching, yin flat abscess and phlegm node.;;1. Its effects on cardiovascular system are similar to epinephrine in many aspects, but persist seven to ten times longer. The myocardial contractility and cardiac output are augmented and cardiac, cerebral and muscular blood flows are increased.2. Its br;Pungent-Warm Exterior-Releasing Medicinal;辛温解表药;1660;493;HERB003658
348;TCMBANKHE005000;花椒;"Pricklyash Peel;Bunge Pricklyash";HUA JIAO;Pericarpium Zanthoxyli;"Warm; Pungent";Spleen; Stomach; Kidney;;;;pericarp;To warm the spleen and the stomach and relieve pain, to kill worms, and to relieve itching.;Spleen-stomach vacuity cold, cold pain in stomach duct and abdomen, vomiting, diarrhea, abdominal pain and vomiting due to roundworm.;;1. Anthelmintic, more effective on Ascaris suis.2. An active component, geraniol, exerts a sedative effect in rats.;Warming Interior Drugs;温里药;4083;354;HERB002424
349;TCMBANKHE005004;五加皮;Slenderstyle Acanthopanax Root-bark Equivalent plant: Acanthopanax sessiliflorus , Acanthopanax senticosus;WU JIA PI;Acanthopanax gracilistylus;"Warm; Pungent; Bitter";Liver; Kidney;;;;;root cortex;To dispel wind-damp, supplement liver and kidney, strengthen sinews and bones, quicken blood and vessels.;Wind-cold-damp impediment, pain in lumbus and knees, limp wilting sinew and bone, infant retardation of walking, vacuity and marked emaciation, knocks and falls, fracture, edema, beriberi, damp itchy in genitals.;;;For dispelling wind-dampness;祛风湿;7654;724;HERB005717
350;TCMBANKHE005005;广西莪术;rhizome of Kwangsi Turmeric;GUANG XI E ZHU;Rhizoma Curcumae;"Warm; Pungent; Bitter";Spleen; Liver;;;;;;Treatment of mass in the abdomen, amenorrhea due to blood stasis, distension and pain due to stagnation of undigested food, carcinoma of cervix at early stage.;Treatment of mass in the abdomen, amenorrhea due to blood stasis, distension and pain due to stagnation of undigested food, carcinoma of cervix at early stage.;;;Blood activation and stasis removal;活血化淤;1655;295;HERB002022
351;TCMBANKHE005013;广地龙;Earthworm;GUANG DI LONG;Pheretima;"Cold; Salty";Bladder; Spleen; Liver;;;;;Treatment of high fever with impaired consciousness, convulsions, arthralgia, numbness of the limbs, hemiplegia, cough and asthma due to heat in the lung, edema ano oliguria, hypertension.;1. Relaxing bronchial spasm in rats or rabbits.2. Intravenous injection of alcoholic infusion (0.1g/kg) lowers blood pressure in anesthetized dogs.3. Sedative and anticonvulsive.4. Lumbrifebrine, one of its active components, is ab antipyretic.;;1. Relaxing bronchial spasm in rats or rabbits.2. Intravenous injection of alcoholic infusion (0.1g/kg) lowers blood pressure in anesthetized dogs.3. Sedative and anticonvulsive.4. Lumbrifebrine, one of its active components, is ab antipyretic.;For calming liver and containing wind;平肝息风;4801;289;HERB001993
352;TCMBANKHE005014;地龙;Earthworm;DI LONG;Pheretima;"Cold; Salty";Bladder; Spleen; Liver;;;;"Phereti a aspergillu (E. Perrier);Pheretima vulgaris Chen;Pheretimaguillelmi(Michaelsen);Phereti apectinifera Michaelsen";Treatment of high fever with impaired consciousness, convulsions, arthralgia, numbness of the limbs, hemiplegia, cough and asthma due to heat in the lung, edema ano oliguria, hypertension.;1. Relaxing bronchial spasm in rats or rabbits.2. Intravenous injection of alcoholic infusion (0.1g/kg) lowers blood pressure in anesthetized dogs.3. Sedative and anticonvulsive.4. Lumbrifebrine, one of its active components, is ab antipyretic.;;1. Relaxing bronchial spasm in rats or rabbits.2. Intravenous injection of alcoholic infusion (0.1g/kg) lowers blood pressure in anesthetized dogs.3. Sedative and anticonvulsive.4. Lumbrifebrine, one of its active components, is ab antipyretic.;For calming liver and containing wind;平肝息风;6935;214;HERB001257
353;TCMBANKHE005039;胖大海;Boat-fruited Sterculia Seed;PANG DA HAI;Semen Sterculiae Lychnophorae;"Sweet; cold";Lung; large intestine;;;;;;To remove heat from the lung, to cure sore throat, to counteract toxicity, and to relax the bowels.;Treament of hoarseness of voice, dry cough, and sore, dry throat due to heat in the lung, constipation with headache and blood-shot eyes.;;;Phlegresolving Medicine;化痰药;7502;1018;HERB004316
354;TCMBANKHE005042;鹿含草;all-grass Chinese pyrola;LU HAN CAO;herba pyrolae chinensis;"Warm; Slightly Sweet; Bitter";Liver; Kidney;;;;;"Pyrola calliantha H. Andres.;Pyrola decorate H. Andres";Treatment of arthralgia with weakness of the loins and knees, excessive menstrual flow, chronic phthisical cough.;Treatment of arthralgia with weakness of the loins and knees, excessive menstrual flow, chronic phthisical cough.;;;For dispelling wind-dampness;祛风湿;5844;473;HERB003527
355;TCMBANKHE005043;鹿衔草;all-grass Chinese pyrola;LU XIAN CAO;herba pyrolae chinensis;"Warm; Sweet; Bitter";Liver; Kidney;;;;;whole herb;To relieve rheumatic conditions, to strengthen the tendons and bones, and to arrest bleeding.;Pulmonary infection, intestinal infection, urinary tract infection, infant diarrhea, acute dysentery, wind-damp impediment pain, lassitude in lumbus and knees, profuse menstruation, enduring cough.;;;Wind-Dampnessdispelling And Colddispersing Medicinal;祛风湿散寒药;1393;482;HERB003549
356;TCMBANKHE005051;紫河车;Human Placenta;ZI HE CHE;Homo sapiens;"Warm; Sweet; Salty";Lung; Liver; Heart; Kidney;;;human placenta;To supplement qi, nourish blood, boost essence.;Vacuity detriment, marked emaciation, steaming bone taxation fever, cough and asthma, hemoptysis, night sweating, emission, impotence, qi -blood depletion, infertility, scant breast milk.;;1. Anti-inflammatory. 2. Exerting gonadotropic effect. 3. Promoting the growth of young animals. 4. Relieving the leukopenia induced by radiation or chemicles. ;For tonifying weakness;补虚;2525;894;HERB007171
357;TCMBANKHE005062;泽泻;"rhizome of Oriental Waterplantain;Oriental Waterplantain;Alisma orientalis";ZE XIE;Rhizoma Alismatis;"Cold; Sweet; Neutral";Bladder; Kidney;;;;;tuber;To cause diuresis, and to remove damp-heat. To transform dampness and promote water metabolism.;Hyperlipemia, inhibited urination, heat strangury with inhibited pain, edema distention fullness, diarrhea, phlegm-rheum dizziness, emission.;;;Diuretic Dampness Excreting Drugs;利水渗湿药;2349;835;HERB006908
358;TCMBANKHE005071;槲寄生;Colored Mistletoe Herb;HU JI SHENG;Herba Visci;"Mild; Bitter";Liver; Kidney;;;;;stem and branch-leaf;To relieve rheumatic conditions, to replenish the liver and the kidney, to strengthen the tendons and the bones, and to prevent abortion.;Hypertension, cerebral and cardiovascular diseases, wind-damp impediment pain, limp aching lumbus and knees, stirring fetus in pregnancy.;;;Wind-Damp-Dispelling And Sinew-Bone-Strengthening Medicinal;祛风湿筋骨药;4132;347;HERB002370
359;TCMBANKHE005082;桃仁;"Peach Seed;Peach Kernel";TAO REN;Semen Persicae;"Mild; Sweet; Bitter";Large Intestine; Liver; Heart;;;;seed;To promote blood circulation, to eliminate phlegm, and to relax the bowels.;Amenorrhea, dysmenorrhea, concretion and conglomeration, lump glomus, knocks and falls, intestinal dry and constipation.;Slightly Toxic;;Blood Activating Stasis Removing Drugs;活血祛瘀药;6079;684;HERB005412
360;TCMBANKHE005090;大血藤;Stem of Sargentgloryvine;DA XUE TENG;Caulis Sargentodoxae;"Mild; Bitter; Punkery";Large Intestine; Liver;;;;;stem;To remove toxic heat, to promote blood circulation, and to relieve rheumatic conditions.;Intestinal welling abscess and abdominal pain, amenorrhea, dysmenorrhea, wind-damp impediment pain, painful swelling from knocks and falls.;;Its decoction possess bacteriostatic effect on Staphylococcus aureus and B-streptococcus..;Antipyretic Detoxicate Drugs;清热解毒药;7141;192;HERB001117
361;TCMBANKHE005091;大活血;Stem of Sargentgloryvine;DA HUO XUE;Caulis Sargentodoxae;"Mild; Bitter";Large Intestine; Liver;;;;;Sargentodoxa cuneata ( Oliv. ) Rehd. et Wils.;Treatment of acute appendicitis, amenorrhea, dysmenorrhea, rheumatic arthralgia, traumatic swelling and pain.;Its decoction possess bacteriostatic effect on Staphylococcus aureus and B-streptococcus..;;Its decoction possess bacteriostatic effect on Staphylococcus aureus and B-streptococcus..;Heat clearence;清热;1577;140;HERB001073
362;TCMBANKHE005093;六神曲;Medicated Leaven;LIU SHEN QU;Massa Medicata Fermentata;"Warm; Pungent; Sweet";Spleen; Stomach;;;;;;Treatment of retention of food manifested as epigastric and abdominal distension and fullness, no appetite, gurgling sound and diarrhea. Medicated leaven (Shenqu) is used with Hawthorn fruit (Shanzha) and Germinated barley (Maiya).;Treatment of retention of food manifested as epigastric and abdominal distension and fullness, no appetite, gurgling sound and diarrhea. Medicated leaven (Shenqu) is used with Hawthorn fruit (Shanzha) and Germinated barley (Maiya).;;;Food digestion;消食;7064;463;HERB003461
363;TCMBANKHE005095;神曲;Medicated leaven;SHEN QU;Massa fermentata medicinalis;"Warm; Pungent; Sweet";Spleen; Stomach;;;;;"Armented annua.;Xanthium sibixicum.;Polygonum hydropiper";Treatment of retention of food manifested as epigastric and abdominal distension and fullness, no appetite, gurgling sound and diarrhea. Medicated leaven (Shenqu) is used with Hawthorn fruit (Shanzha) and Germinated barley (Maiya).;Treatment of retention of food manifested as epigastric and abdominal distension and fullness, no appetite, gurgling sound and diarrhea. Medicated leaven (Shenqu) is used with Hawthorn fruit (Shanzha) and Germinated barley (Maiya).;;;Food digestion;消食;4029;637;HERB005005
364;TCMBANKHE005110;马勃;Puff-ball;MA BO;Lasiosphaera seu Calvatia;"Mild; Pungent";Large Intestine; Liver;;;;;sporocarp;To remove heat from the lung and soothe sore throat, and to arrest bleeding.;Cough, aphonia, nosebleed(epistaxis), bleeding due to external injury.;;1. Haemostatic2. Its aqueous extract inhibits the growth of cutaneous fungi.;Antipyretic Detoxicate Drugs;清热解毒药;4551;490;HERB003638
