Row ID;TCMBank_ID;TCM_name;TCM_name_en;Herb_pinyin_name;Herb_latin_name;Properties;Meridian 1;Meridian 2;Meridian 3;Meridian 4;Meridian 5;Meridian 6;UsePart;Function;Indication;Toxicity;Clinical_manifestations;Therapeutic_en_class;Therapeutic_cn_class;TCM_ID_id;TCMSP_id;Herb_ID
482;TCMBANKHE006400;南瓜子;Pumpkin seed and husks;NAN GUA ZI;Semen Cucurbitae moschatae;"Sweet; neutral";Stomach; large intestine;;;;;seed;To kill parasites;Taeniasis, ascariasis, bilharziosis, ancylostomiasis, oxyuria disease, postpartum scant milk, postpartum edema, pertussis, hemorrhoids.;;1. Synergetic with Arecae for tapeworm infection. 2. Cucurbitine, one of its components, is schistosomicidal.;Antiparasitic Drugs;驱虫药;2697;1013;HERB004092
483;TCMBANKHE006403;荆芥;all-grass of Fineleaf Schizonepeta;JING JIE;Herba Schizonepetae;"Minor Warm; Pungent";Lung; Liver;;;;;aerial parts;To induce diaphoresis, to dispel wind, and to promote eruptions.;Common cold with fever, headache, itchy eye, cough, swelling pain in throat, measles papules, wind papules, swollen welling abscess, sore and scab, throat pain, conjunctivitis, child measles, spontaneous external bleeding, blood ejection, hematochezia, flooding and spotting, postpartum blood dizziness.;;1. Mils antipyretic effect.2. Oral use of its decoction can promote the secretion of sweat glands and improve cutaneous blood circulation;Pungent-Warm Exterior-Releasing Medicinal;辛温解表药;4526;412;HERB002983
484;TCMBANKHE006404;芥穗;all-grass of Fineleaf Schizonepeta;JIE SUI;Herba Schizonepetae;"Warm; Pungent";Lung; Liver;;;;;Schizonepeta tenuifolia Briq.;Treatment of common cold, headache, measles rubella, sores at theearly stage.Carbonized Herba Schizonepetae Hematochezia, abnormal uterine bleeding, fainting after delivery due to excessive bleeding.;1. Mils antipyretic effect.2. Oral use of its decoction can promote the secretion of sweat glands and improve cutaneous blood circulation;;1. Mils antipyretic effect.2. Oral use of its decoction can promote the secretion of sweat glands and improve cutaneous blood circulation;For relieving exterior syndrome;解表;1287;399;HERB002884
485;TCMBANKHE006426;洋金花;"Datura Flower;Hindu Datura Flower";YANG JIN HUA;Flos Daturae;"Pungent;  warm";Heart;  lung; spleen;;;;seed ,  abdomen, wind-damp impediment pain, knocks and falls, epilepsy, chronic fright wind, anesthesia;To relieve asthma and cough, to alleviate pain, and to arrest spasm.;Cough and asthma without phlegm, cold pain in heart and Datura stramonium .;toxic;1. Exerting peripheral parasympatholytic effect, and causing tachycardia, mydriasis, dryness of skin and mouth, and relaxation of alimentary and bronchial smooth muscles.2. Acting as a central depressor stronger than Atropine, occasionally inducing halluc;Antitussive Antiasthmetics;止咳平喘药;6237;1077;HERB006387
486;TCMBANKHE006428;肉苁蓉;Desertliving Cistanche;ROU CONG RONG;Herba Cistanches;"Warm; Sweet; Salty";Large Intestine; Kidney;;;;;fleshy stem;To reinforce the kidney, replenish vital essence and blood, and induce Taxation.;Impotence, infertility, backache, limp aching lumbus and knees, weakness in sinews and bones, intestinal dry and constipation.;;1. Hypotensive2. Promoting saliva secretion.;Yang Reinforcing Drugs;补阳药;1883;596;HERB004692
487;TCMBANKHE006430;龙胆草;"root of Przewalsk Gentian;Gentiana scabra";LONG DAN CAO;Radix Gentianae;"Cold; Bitter";Bladder; Liver; Gallbladder;;;;"Gentiana manshurica Kitag.;Gentiana scabra Bge.;Gentiana triflora Pall.;Gentiana ringescens Franch.";Treatment of jaundice caused by damp-heat, swelling and itching of the vulva with excessive leukorrhea, prolonged erection of the penis with spontaneous emission, eczema accompanied by itching, blood-shot eyes, impairment of hearing, pain in the costal regions and bitter taste in the mouth, convulsion.;Treatment of jaundice caused by damp-heat, swelling and itching of the vulva with excessive leukorrhea, prolonged erection of the penis with spontaneous emission, eczema accompanied by itching, blood-shot eyes, impairment of hearing, pain in the costal re;;;Heat clearence;清热;1333;466;HERB003479
488;TCMBANKHE006453;罗汉果;"Grosvenor Momordica Fruit;Grosvenor Siraitia";LUO HAN GUO;Fructus Momordicae;"Cool; Sweet";Lung; Large Intestine;;;;;fruit;To remove heat, moisten the lung and relax the bowels.;Lung heat dry cough, common cold, throat pain, laryngitis, aphonia due to throat pain, intestinal dry and constipation.;;;Phlegresolving Medicine;化痰药;3029;484;HERB003582
489;TCMBANKHE006464;紫背天葵;Gynura;ZI BEI TIAN KUI;Herba Gynurae bicoloris;"Cold; Sweet";Spleen; Kidney;;;;;Gynura bicofor DC;Treatment of carbuncles, boils and sores, mastitis, scrofula, venomous snake bite.;Treatment of carbuncles, boils and sores, mastitis, scrofula, venomous snake bite.;;;Heat clearence;清热;6318;892;HERB007157
490;TCMBANKHE006470;阴行草;Chinese Siphonostegia;YIN XING CAO;Siphonostegia chinensis;"Bitter; warm";Heart; spleen;;;;;whole herb;To clear heat and disinhibit damp, quicken blood and dispel stasis.;Jaundice, inhibited urination, abdominal distention with edema, stasis pain from knocks and falls, blood dysentery, blood strangury, vaginal discharge, menstrual disorder, concretion conglomeration accumulation and gathering, postpartum abdomin al pain.;;;Blood activation and stasis removal;活血化淤;1376;808;HERB006631
491;TCMBANKHE006493;五味子;"Schisandra chinensis;Chinese Magnoliavine Equivalent plant: Schisandra sphenanthera;Chinese Magnoliavine";WU WEI ZI;Schisandra chinensis;"Warm; Sour";Lung; Heart; Kidney;;;;fruit;To promote contraction and secure astriction, boost qi and engender liquid, quiet heart and spirit.;Enduring cough and vacuity asthma, dream emission, frequent urination and enuresis, incessant chronic diarrhea, spontaneous sweating and night sweating, fluid damage and thirst, palpitation and insomnia.;;1. Its decoction exerts bacteriostatic effect on Pseudomonas aeruginosa (1:128), Staphylococcus aureus (1:64), Flexner's bacillus (1:32) and typhoid bacillus (1:8) in vitro.2. Schizandrin, one of its active components, can protect the liver from damage.3.;Astriction;收涩;1518;728;HERB005762
492;TCMBANKHE006499;胡椒;"Pepper Fruit;Piper nigrum;Black Pepper";HU JIAO;Fructus Piperis;"Hot; Pungent";Large Intestine; Stomach;;;;;fruit;To dispel cold from the stomach, and to eliminate phlegm.;Vomiting with stomach cold, abdominal pain and diarrhea, inappetence, convulsion, epilepsy and profuse phlegm.;;1. Increasing secretion of digestive and promoting gastrointestinal peristalsis by oral administration.2. Piperine is an antipyretic and wind-expelling agent.;Warming Interior Drugs;温里药;1970;348;HERB002371
493;TCMBANKHE006504;鸡内金;Chicken’s Gizzard Endothelium;JI NEI JIN;Gallus gallus domesticus;"Mild; Sweet";Bladder; Spleen; Stomach; Small Intestine;;;dried lining membrane of gizzard;To fortify spleen and disperse food, rough essence and arrest emission, disperse concretion and transform stone.;Indigestion, food stagnation, vomiting nausea, diarrhea and dysentery, child gan accumulation, emission, enuresis, frequent urination, calculus of urinary system, gallstones, amenorrhea with concretion and conglomeration, throat impediment with nipple moth, gan of teeth and gum, mouth sore.;;;Food digestion;消食;1739;380;HERB002690
494;TCMBANKHE006505;白扁豆;"White Hyacinth Bean;Dolichos lablab";BAI BIAN DOU;Semen Lablab Album;"Minor Warm; Sweet";Spleen; Stomach;;;;;;To invigorate the spleen and remove damp, paticularly the summer damp.Semen Lablab Album (stir-fried) To invigorate the spleen and remove damp.;Treatment of weakness of the spleen and stomach with loss of appetite and loose bowels, excessive leukorrhea, vomiting, diarrhea, distress in the chest and distension in the abdomen caused by summer-damp.Semen Lablab Album (stir-fried) Diarrhea and excess;;;Qi Reinforcing Drugs;补气药;2519;13;HERB000161
495;TCMBANKHE006507;粳米;"Rice; polished round-grained rice
polished round-grained rice";JING MI;Oryza sativa;"Warm; Sweet";Lung; Spleen; Stomach;;;;seed;To supplement qi and fortify spleen, eliminate vexation and allay thirst, check dysentery and diarrhea .;Spleen-stomach vacuity, reduced food intake, fatigue hypodynamia, vexation and thirst, diarrhea.;;;;;6036;413;HERB002989
496;TCMBANKHE006523;芫花;"Lilac Daphne; flower bud of Lilac Daphne; Daphne genkwa";YUAN HUA;Flos Genkwa;"Warm; Pungent; Bitter";Lung; Large Intestine; Kidney;;;;bud;"1. To transform water and stop cough; 2. To resolve phlegm and stop cough; 3. To kill worms";Edema, ascites, hydrothorax, cough with profuse phlegm, chronic bronchitis, malaria, scalp infection, infection of skin, tinea capitis, neurodermatitis, induce abortion, toothache.;Toxic;1. Diuretic. Oral use of its decoction increases urinary volume by 7-13% in rats within 5 hours.2. Its diuretic effect is decreased and its toxicity increased when it is used together with Radix Euphorbiae Pekinensis and Radix Glycyrrhizae.3. Its alcoholi;Drastic Purgatives;通水药;7504;819;HERB006773
497;TCMBANKHE006554;地榆;"Root of Garden Burnet; Garden Burnet";DI YU;Radix Sanguisorbae;"Minor cold; Sour; Bitter";Large Intestine; Stomach; Liver;;;;root;To arrest bleeding by dispelling heat for blood, and to counteract toxicity and cure sores.;Blood ejection, hemoptysis, duodenal ulcer, spontaneous external bleeding, hematuria, hematochezia, bleeding from hemorrhoids, blood dysentery, flooding and spotting, red and white vaginal discharge, swelling pain of welling abscess and sore, eczema, pudendal itch, burns and scalds, snake or insect bites.;;1. Its powder is effective for scald in experimental animals.2. Hemostatic.3. Inhibiting growth of various pathogenic bacteria.;Blood-Cooling Hemostatic Medicinal;凉血止血药;6800;216;HERB001271
498;TCMBANKHE006566;牡丹皮;"Tree Peony Bark; Subshrubby Peony Root-Bark; Paeonia suffruticosa";MU DAN PI;Cortex Moutan;"Minor cold; Pungent; Bitter";Liver; Heart; Kidney;;;;root cortex;To remove heat from blood, to activate blood circulation and eliminate blood stasis.;Appendicitis, dysentery, hypertension, allergic rhinitis, warm heat disease with fever, macular eruption, blood ejection, spontaneous external bleeding, steaming bone tidal fever due to yin vacuity, amenorrhea due to blood stasis, dysmenorrhea, concretion and conglomeration, swelling toxin of welling abscess and sore, painful wound from knocks and falls, wind-damp-heat impediment.;;1. Antibacterial and anti-inflammatory.2.Sedative. In moused 125mg/kg intraperitoneally3. Analgesic. In mouse 1.0g/kg for gastric infusion.4. Anticonvulsive. Relieving the convulsive seizures in experimental animals induced by electric stimulation or inje;Heat Clearing Blood Cooling Drugs;清热凉血药;5813;516;HERB004013
499;TCMBANKHE006570;青蒿;"Sweet Wormwood Herb; Artemisia annua";QING HAO;Herba Artemisiae Annuae;"Bitter;  pungent; cold";Liver; bladder; kidney;;;;whole herb;To remove summer-heat, to relieve consumptive fever,and to stop malarial attacks.;See Artemisia annua.;;1. Artemisinine from its volatile oil is an effective antimalarial agent on mice, monkey, chicken and human malaria. The malarial parasite will disappear in blood after oral administration of 100mg/kg for 3 days in mice and 200mg/kg for2-3 days in monkey.;Asthenic Heat Dispelling Drugs;清虚热药;7616;1026;HERB004520
500;TCMBANKHE006576;诃子;"Medicine Terminalia Fruit; Terminalia chebula";HE ZI;Fructus Chebulae;"Mild; Sour; Bitter; Punkery";Lung; Large Intestine;;;;;fruit;To check diarrhea and chronic cough, and to soothe the sore throat.;Chronic diarrhea and dysentery, hematochezia, prolapse of rectum, cough and asthma due to lung vacuity, incessant cough, aphonia due to throat pain.;;1. Exerting as an astringent for mucosal ulcer in case of enteritis. 2. Chebulin, one of its components, causes relaxation of smooth muscles similar to papaverine. ;Astringent Medicinal;收涩药;7932;327;HERB002194
501;TCMBANKHE006580;瓜蒂;"Muskmelon base; Muskmelon Pedicel; Cucumic melo";GUA DI;Calycis Melo;"Cold; Bitter";Stomach;;;;;;fruit pedicel;Vomiting promotion;Wind stroke, epilepsy, throat impediment, indigestion of overnight food, distending pain in stomach duct, damp-heat jaundice, chronic hepatitis, cirrhosis.;Extremely Toxic;;Emetic Medicinal;涌吐药;3841;284;HERB001948
502;TCMBANKHE006587;续断;"Himalayan Teasel Root; Japanese Teasel Root; Dipsacus asperoides";XU DUAN;Radix Dipsaci;"Minor Warm; Pungent; Sweet; Bitter";Liver; Kidney;;;;;root;For tonifying yang;See Dipsacus asperoides.;;;Yang Reinforcing Drugs;补阳药;2428;776;HERB006259
503;TCMBANKHE006598;安息香;Benzoin;AN XI XIANG;Benzoinum;"Mild; Pungent; Bitter";Spleen; Heart;;;;;balsam;To restore consciousness. To activate the flow of qi and blood. To relieve pain.;Sudden stroke and fulminant reversal, pain in heart and abdomen, postpartum blood dizziness, child fright epilepsy, wind impediment and lumbago.;;;"Resuscitative Stimulant; Resuscitative Medicinal";开窍药;5347;6;HERB000090
504;TCMBANKHE006600;飞廉;Curly Bristlethistle Equivalent plant: Carduus acanthoides;FEI LIAN;Carduus crispus;"Cold; Bitter; Salty";Large Intestine; Stomach;;;;;root or whole herb;To dispel wind, clear heat, disinhibit damp, cool blood and stanch bleeding, quicken blood and disperse swelling.;Common cold with cough, headache and dizziness, infection of urinary system, chyluria, vaginal discharge, jaundice, wind-heat impediment pain, blood ejection, spontaneous external bleeding, hematuria, profuse menstruation, dysfunctional uterine bleeding, knocks and falls, clove sore and swollen boil, toxin swelling from hemorrhoids, scalds.;;;;;6075;242;HERB001641
505;TCMBANKHE006622;刘寄奴;Siphonostegia;LIU JI NU;Herba Artemisiae Anomalae;"Warm; Bitter";Spleen; Liver; Heart;;;;"Artemsia anomala S. Moore;Siphonostegia chinensis Benth.";Treatment of: 1. Blood stagnation manifested as dysmenorrhea, amenorrhea, postpartum abdominal pain or swelling and pain due to external injuries. Siphonostegia (Liujinu) is used with Chinese angelica root (Danggui), Corydalis tuber (Yanhusuo) and Chuanxiong rhizome (Chuanxiong). 2. Hemorrhages and pain due to external injuries. The powder of Siphonostegia (Liujinu) is used alone, externally.;Treatment of: 1. Blood stagnation manifested as dysmenorrhea, amenorrhea, postpartum abdominal pain or swelling and pain due to external injuries. Siphonostegia (Liujinu) is used with Chinese angelica root (Danggui), Corydalis tuber (Yanhusuo) and Chuanxi;;;Blood activation and stasis removal;活血化淤;6637;462;HERB003451
506;TCMBANKHE006631;铅丹;Red Lead;QIAN DAN;Minium;"Minor cold; Pungent";Liver; Cardiovascular;;;;;;1. Treatment of scabies, pustulosis, unhealed lesion, burn, etc., usually mixed with honey for external use. 2. Treatment of malaria, used together with Herba Artemisiae Annuae or Radix Dichroae.;It chiefly contains Pb3O4 or 2PbO.PbO2. It is a bactericide and parasticide, and inhibits the secretion of mucosa.;Toxic;It chiefly contains Pb3O4 or 2PbO.PbO2. It is a bactericide and parasticide, and inhibits the secretion of mucosa. ;For eliminating toxic materials, dissolving rottenness and growing new muscles;拔毒化腐生肌;5999;562;HERB004450
507;TCMBANKHE006641;牛黄;Cow-bezoar (Ox-gaIIstone);NIU HUANG;Calculus Bovis;"Cool; Bitter";Liver; Heart;;;;;gallstone;To restore consciousness by reducing fire and eliminating phlegm , to relieve convulsions, and to counteract toxicity.;Ardent fever, coma, fright epilepsy, convulsion, febrile diseases clouded spirit, wind stroke with orifice block, acute infant fright wind, swelling pain in throat, mouth and tongue sores, welling abscess and flat abscess with clove sore.;;1. Oral administration lowers experimental fever in guinea-pigs (200mg/kg) and in rats (300mg/kg).2. Oral intake in a dosage of 600mg/kg/day for 6 days exerts an anticonvulsive effect.3. Increasing biliary secretion.4. Lowering blood pressure in rats with;"Resuscitative Stimulant; Resuscitative Medicinal";开窍药;4459;531;HERB004201
508;TCMBANKHE006652;莲子;Hindu Lotus Seed;LIAN ZI;Nelumbo nucifera;"Mild; Sweet; Punkery";Spleen; Heart; Kidney;;;;seed;To supplement spleen and check diarrhea, boost kidney and secure essence, nourish heart and quiet spirit.;Chronic diarrhea, inappetence, emission, restlessness, fright palpitation, insomnia, flooding and spotting, excessive leukorrhea.;;;Astriction;收涩;6604;452;HERB003376
509;TCMBANKHE006660;桂枝;Cassia Twig;GUI ZHI;Ramulus Cinmomi;"Warm; Pungent; Sweet";Lung; Bladder; Heart;;;;twig;To induce perspiration, to warm the channels and stimulate menstrual discharge, to reinforce yang, to relieve palpitation, and to promote the descending of qi.;Wind-cold exterior syndrome, cold-damp impediment pain, reversal cold of limbs, amenorrhea and dysmenorrhea, concretion and conglomeration, chest impediment, palpitation, phlegm-rheum, inhibited urination.;;1. Sedative , analgesic and anticonvulsive: Intraperitoneal injection of cinnamic aldehyde relieves pain elicited by acetic acid in mice and antagonizes strychnine-induced tonic convulsion (500mg/kg).2. Antipyretic: Lowering vaccine-induced fever in rabbi;Pungent-Warm Exterior-Releasing Medicinal;辛温解表药;3977;303;HERB002062
510;TCMBANKHE006661;"辰砂;朱砂";"cinnabar;Cinnabar";"CHEN SHA;ZHU SHA";"cinnabaris;Cinnabaris";"Cold; Sweet";Heart;;;;;;;Treatment of palpitaion, insomnia and dream - disturbed sleep, epilepsy, mania, infantile convulsion, blurred vision, ulcers in the mouth, painful swelling of the throat, boils and sores.;Treatment of palpitaion, insomnia and dream - disturbed sleep, epilepsy, mania, infantile convulsion, blurred vision, ulcers in the mouth, painful swelling of the throat, boils and sores.;;;Spirit calming;安神;"4069;5260";"97;886";"HERB000776;HERB007117"
511;TCMBANKHE006664;"牛蒡子;大力子";"Great Burdock  Fruit ;achene of Great Burdock";"NIU BANG ZI;DA LI ZI";Fructus Arctii lappae;"Cold; Pungent; Bitter";Lung; Stomach;;;;;"fruit;Arctium lappa L.";"To dispel wind-heat and relieve cough, to promote eruption, to counteract toxicity, and to soothe sore throat;Treament of cough and expectroation in influenza or upper respiratory infection, measles, rubella, sore throat, mumps, erysipelas, carbuncles and sores.";"Wind-heat common cold, cough with profuse phlegm, measles papules, wind papules, swelling pain in throat, epidemic parotitis;1. Its extract exerts a significant and prolonged effect of lowering blood sugar in rats.2. Mildly diuretic and laxative.3. An active component, arctiin, can induce tonic convulsion, feeble respiration and eventually paralysis in frogs, mice and rabbits. erysipelas, swollen welling abscess and sore toxin.";;1. Its extract exerts a significant and prolonged effect of lowering blood sugar in rats.2. Mildly diuretic and laxative.3. An active component, arctiin, can induce tonic convulsion, feeble respiration and eventually paralysis in frogs, mice and rabbits.;"Pungent Cool Diaphoretics;For relieving exterior syndrome";辛凉解表药;"3673;1266";"530;143";"HERB004191;HERB001086"
512;TCMBANKHE006690;蜈蚣;Centipede;WU GONG;Scolopendra subspinipes mutilans;"Warm; Pungent";Liver;;;;;;dried body;To calm, lower blood pressure, extinguish wind and check tetany, resolve toxin and dissipate binds, free network vessels and relieve pain.;Acute fright wind, chronic fright wind, tetanus, spasm, convulsion, toxin swelling of sores and open sores, scrofula with ulceration, intractable headache with pulling sensation, wind-damp impediment pain, hypertension.;Extremely Toxic;1. Anti-convulsive. 2. Inhibiting the growth of dermatomyces in vitro. 3. Bacteriostatic and bacteriocidal, especially for Bacillus tuberculosis. ;For calming liver and containing wind;平肝息风;3900;722;HERB005706
513;TCMBANKHE006735;灵仙;root and rhizome of smilax;LING XIAN;Radix Smilacis;"Warm; Pungent; Salty";Bladder;;;;;;"Smilax scobinicaulis C. H. Wright;Smilax sieboldii Miq";Treatment of rheumatic or rheumatoid arthralgia with numbness of the limbs, muscle contracture and limitation of motion, fish bone stuck in the throat.;1. Inhibiting the growth of Stanphylococcus aureus and Shigella dysenteriae.2. Protoanemonin antagonizes histamine-induced bronchospasm and ileospam of guinea-pigs in vitro.;;1. Inhibiting the growth of Stanphylococcus aureus and Shigella dysenteriae.2. Protoanemonin antagonizes histamine-induced bronchospasm and ileospam of guinea-pigs in vitro.;For dispelling wind-dampness;祛风湿;6094;457;HERB003437
514;TCMBANKHE006755;"田基黄;地耳草";all - grass of Japanese St. Johnswort;"TIAN JI HUANG;DI ER CAO";Herba Hyperici japonici;"Mild; Bitter";Liver; Gallbladder;;;;;"Grangea maderaspatana (L.) Poir;whole herb";1.To deprive dampness and relieve jaundice. 2. To clear away heat and toxic material. 3. To promote blood circulation and relieve edema.;Damp-heat jaundice, diarrhea, dysentery, intestinal welling abscess, pulmonary welling abscess, swelling toxin of welling abscess and boil, nipple moth, mouth sore, red eyes with gall, poisonous snake bite, knocks and falls.;;1. Promoting the neutrophilic phagocytosis in mice.2. Inhibiting the growth of Staphylococcus and Shigella dysenteriae in vitro.;Diuretic Dampness Excreting Drugs;利水渗湿药;"3904;5275";"689;920";"HERB005445;HERB001244"
515;TCMBANKHE006761;藕节;"Nodus Nelumbinis Rhizomatis;node of lotus rhizome";OU JIE;nodus nelumbinis rhizomatis;"Mild; Sweet; Punkery";Stomach; Liver; Heart;;;;;To arrest bleeding and remove blood stasis.;Treament of hematemesis, hemoptysis, hematuria, abnormal uterine bleeding.;;;Astringent Hemostatic Medicinal;收敛止血药;4264;536;HERB004251
516;TCMBANKHE006781;防风;"root of Divaricate Saposhnikovia;Saposhnikovia divaricata;Divaricate Saposhnikovia";FANG FENG;Radix Saposhnikoviae divaricatae;"Minor Warm; Pungent; Sweet";Bladder; Spleen; Liver;;;;root;To induce diaphoresis, to dispel wind, to alleviate rheumatic conditions, and to relieve spasm.;Migraine, headache and generalized pain, common cold, rheumatoid arthritis, externally contracted wind-cold, wind-damp impediment pain, aching pain in joints, abdominal pain and diarrhea, intestinal wind bleeding, tetanus, wind papule itching, sores.;;1. Antipyretic: Oral use of decoction and alcoholic infusion (2.0g/kg) can lower vaccine-induced fever in rabbits.2. Analgesic: Oral use of alcoholic infusion (21.18g/kg) and subcutaneous injection (42.36g/kg) can alleviate pain.;Pungent-Warm Exterior-Releasing Medicinal;辛温解表药;7847;239;HERB001622
517;TCMBANKHE006816;海浮石;Pumice;HAI FU SHI;Pumex;"Cold; Salty";Lung;;;;;;;1. Treatment of phlegm-heat cough manifested as cough with yellow, sticky and thick sputum or sputum difficult to expectorate. Costazia bone (Haifushi) is used with Sea clam shell (Haigeke), Trichosanthes fruit (Gualou), Capejasmine (Zhizi) and Natural indigo (Qingdai). 2. Treatment of scrofula and goiter caused by phlegm and qi accumulation. Costazia bone (Haifushi) is used with Oyster shell (Muli), Tendrilled fritillary bulb (Chuanbeimu), Scrophularia (Xuanshen) and Laminaria (Kunbu).;1. Treatment of phlegm-heat cough manifested as cough with yellow, sticky and thick sputum or sputum difficult to expectorate. Costazia bone (Haifushi) is used with Sea clam shell (Haigeke), Trichosanthes fruit (Gualou), Capejasmine (Zhizi) and Natural in;;;For desolving phlegm, stopping cougth, and soothing breathing;化痰止咳平喘;3960;306;HERB002088
518;TCMBANKHE006861;人中白;Human Urine Sediment;REN ZHONG BAI;Homo sapiens;"Cold; Salty";Lung; Bladder; Liver;;;;sediment of human urine;To clear heat, downbear fire, disperse stasis.;Taxation fever, lung wilting, spontaneous external bleeding, blood ejection, throat impediment, gan of teeth and gum, mouth sore, tongue sores.;;;Heat clearence;清热;2688;595;HERB004618
519;TCMBANKHE006865;水蛭;Bigflower Cape Jasmine;SHUI ZHI;Gardenia jasminoides var. grandiflora;"Mild; Bitter; Salty";Liver;;;;;;fruit;To clear heat and resolve toxin, disperse swelling and relieve pain.;Heat toxin, jaundice, nosebleed(epistaxis), nephritis with edema, sprain and contusion.;Slightly Toxic;one of its components, hirudin, is an anticoagulant.;Blood activation and stasis removal;活血化淤;6636;669;HERB005206
520;TCMBANKHE006878;犀角;Rhinoceros Horn;XI JIAO;Rhinoceros unicornis , Rhinoceros sondaicus , Rhinoceros sumatrensis;"Cold; Sour; Bitter; Salty";Stomach; Liver; Heart;;;;horn;To cool blood, clear heat, resolve toxin, settle fright.;Blood ejection, spontaneous external bleeding, acute febrile diseases, epidemic febrile diseases.;;;Heat clearence;清热;6274;741;HERB005835
521;TCMBANKHE006914;鬼箭羽;twig of Winged Euonymus;GUI JIAN YU;Ramulus Euonymi;"Cold; Bitter";Liver;;;;;;Euonymus alatus(Thunb.) Sieb;For activating blood and modulating period;Concretion and conglomeration, pain in heart and abdomen, amenorrhea, dysmenorrhea, postpartum stasis stagnation abdominal pain, retention of lochia, mounting qi , joint running impediment pain, swelling of sores, painful wound from knocks and falls, burns and scalds, poisonous snake bite.;;;Blood Activating Stasis Removing Drugs;活血祛瘀药;"5255;7075";300;"HERB002052;HERB002053"
522;TCMBANKHE006919;款冬花;flower bud of common coltsfoot;KUAN DONG HUA;flos farfarae;"Cool; Pungent; Slightly Bitter";Lung;;;;;;;To relieve cough and resolve phlegm to nourish the lung to keep the adverse qi downward.;Cough, cough and asthma with abundant phlegm, consumption cough and hemoptysis, chronic bronchitis, infection of upper respiratory tract, tuberculosis.;;1. Antitussive and expectorant. 2. Relieving bronchospasm.;Antitussive Antiasthmetics;止咳平喘药;2074;435;HERB003192
