Row ID;TCMBank_ID;TCM_name;TCM_name_en;Herb_pinyin_name;Herb_latin_name;Properties;Meridian 1;Meridian 2;Meridian 3;Meridian 4;Meridian 5;Meridian 6;UsePart;Function;Indication;Toxicity;Clinical_manifestations;Therapeutic_en_class;Therapeutic_cn_class;TCM_ID_id;TCMSP_id;Herb_ID
164;TCMBANKHE003009;绿萼梅;Mume flower, Japanese apricot flower;LU E MEI;Flos Mume;"Sour;  astringent; neutral";Liver; stomach;;;;;Prumus mume (Sieb.) Zieb. et Zucc.;Treatment of: 1. Qi stagnation in the liver and stomach manifested as distension and pain in the hypochondriac regions, belching and epigastric pain. Mume flower (Lu'emei) is used with Bupleurum root (Chaihu), Cyperus tuber (Xiangfu), Green tangerine peel (Qingpi) and Costus root (Muxiang). 2. Phlegm and qi stagnated in the throat (globus hystericus) manifested as the sensation of a foreign body in the throat. Mume flower (Lu'emei) is used with Trichosanthes peel (Gualoupi), Tangerine peel (Chenpi), Mulberry bark (Sangbaipi), Albizia bark (Hehuanpi) and Perilla leaf (Zisuye).;Treatment of: 1. Qi stagnation in the liver and stomach manifested as distension and pain in the hypochondriac regions, belching and epigastric pain. Mume flower (Lu'emei) is used with Bupleurum root (Chaihu), Cyperus tuber (Xiangfu), Green tangerine peel;;;Regulation of qi;理气;5696;998;HERB003523
165;TCMBANKHE003015;制乳香;Prepared Frankincense;ZHI RU XIANG;Resina Olibani Praparata;"Warm; Pungent; Bitter";Spleen; Liver; Heart;;;;Boswellia carterii Birdw;Treatment of pains caused by blood stagnation;1. Exerting significant analgesic effect.2. Dilating the peripheral blood vessels.3. Enhancing the phagocytosis of macrophages in the abdominal cavity of mice.;;1. Exerting significant analgesic effect.2. Dilating the peripheral blood vessels.3. Enhancing the phagocytosis of macrophages in the abdominal cavity of mice.;Blood activation and stasis removal;活血化淤;1564;868;HERB007029
166;TCMBANKHE003020;蜗牛;Snail;WO NIU;Eulota;"Cold; Salty";Bladder; Large Intestine; Stomach; Liver;;;;For containing wind and stopping pain;;;;For calming liver and containing wind;平肝息风;4149;720;HERB005689
167;TCMBANKHE003063;车前草;all-grass of Rippleseed plantain;CHE QIAN CAO;Herba Plantaginis;"Cold; Sweet";Lung; Liver; Kidney;;;;;To remove heat and to induce diureses, to promote expectoration, to reduce heat in blood and to counteract toxicity.;Treatment of edema with oliguria, urinary infection with difficult painful urination, diarrhea caused by summer-damp, cough caused by phlegm-heat, spitting of blood, epistaxis, carbuncles and sores.;;;Diuretic Dampness Excreting Drugs;利水渗湿药;6593;93;HERB000767
168;TCMBANKHE003087;建曲;;JIAN QU;;"Warm; Pungent; Sweet";Spleen; Stomach;;;;;;Food digestion;;;;Food digestion;消食;7801;387;HERB002804
169;TCMBANKHE003114;丁香叶;Clove leaf;DING XIANG YE;Folium Caryophylli;"Warm; Pungent";Spleen; Stomach; Kidney;;;;Eugenia caryophylata Thunb;Treatment of hiccup, vomiting, anorexia, diarrhea and epigastric and abdominal pain with cold sensation in deficiencycold syndromes of the spleen and stomach, impotence due to deficiency of the kidney yang.;Treatment of hiccup, vomiting, anorexia, diarrhea and epigastric and abdominal pain with cold sensation in deficiencycold syndromes of the spleen and stomach, impotence due to deficiency of the kidney yang.;;;For warming interior;温里;1331;221;HERB001315
170;TCMBANKHE003157;赤石脂;Red Halloysite;CHI SHI ZHI;Halloysitum Rubrum;"Warm; Sweet; Sour; Punkery";Large Intestine; Stomach;;;;;;Treatment of chronic diarrhea, chronic dysentery, hematochezia, abnormal uterine bleeding, excessive leukorrhea, external use for ulcers difficult to heal up, eczema with exudation.;Treatment of chronic diarrhea, chronic dysentery, hematochezia, abnormal uterine bleeding, excessive leukorrhea, external use for ulcers difficult to heal up, eczema with exudation.;;;Astriction;收涩;6358;101;HERB000803
171;TCMBANKHE003163;花生衣;Semino-dermis Arachidis ;HUA SHENG YI;Testa Arachidis Hypogaeae;"Mild; Sweet; Punkery";Lung; Stomach; Liver;;;;;To stop bleeding by astringing bleeding and enrich blood. ;Inhibiting fibrinolysis, promoting thrombocytopoiesis and shortening the bleeding time.;;Inhibiting fibrinolysis, promoting thrombocytopoiesis and shortening the bleeding time.;Astringent Hemostatic Medicinal;收敛止血药;7373;357;HERB002448
172;TCMBANKHE003208;鹿角胶;Gelatin of Buckhorn;LU JIAO JIAO;Pulvis Cornu Cervi;"Warm; Sweet; Salty";Liver; Kidney;;;;;;For tonifying yang;;;;For tonifying weakness;补虚;3655;476;HERB003531
173;TCMBANKHE003230;大独活;root of Laxflower Cowparsnip;DA DU HUO;Radix Heraclei maximi;"Minor Warm; Pungent; Bitter";Bladder; Liver;;;;;Heracleum maximum Bartram;Treatment of rheumatic arthritis with pain in the lower back and knees, headache due to attack of cold on the Shaoyin Channel characterized by association of headache with precordial pain and cold legs.;Treatment of rheumatic arthritis with pain in the lower back and knees, headache due to attack of cold on the Shaoyin Channel characterized by association of headache with precordial pain and cold legs.;;;For dispelling wind-dampness;祛风湿;5412;135;HERB001024
174;TCMBANKHE003238;乌梢蛇;Black-tail Snake;WU SHAO SHE;Zaocys;"Mild; Sweet";Liver;;;;;;Zaocys dhumnades (Cantor).;Treatment of chronic rheumatiod arthritis with numbness and ankylosis, hemiplegia in stroke, convulsion, tetanus, leprosy, scabies, scrofula with suppuration.;Treatment of chronic rheumatiod arthritis with numbness and ankylosis, hemiplegia in stroke, convulsion, tetanus, leprosy, scabies, scrofula with suppuration.;;;For dispelling wind-dampness;祛风湿;5145;727;HERB005750
175;TCMBANKHE003242;石莲子;Lotus seed;SHI LIAN ZI;Semen Nelumbinis;"Sweet;  astringent; neutral";Spleen;  kidney; heart;;;;Nelumbo nucifera Gaertn.;Treatment of protracted diarrhea due to hypofunction of the spleen, seminal emission, leukorrhagia, palpitation, insomnia.;Treatment of protracted diarrhea due to hypofunction of the spleen, seminal emission, leukorrhagia, palpitation, insomnia.;;;Astriction;收涩;4719;656;HERB005068
176;TCMBANKHE003269;制首乌;Prepared FLeeceflower Root;ZHI SHOU WU;Radix Polygoni Multiflori Preparata;"Minor Warm; Sweet; Bitter; Punkery";Liver; Heart; Kidney;;;;Radix Polygoni Multiflori;Treatment of anemia, dizziness and tinnitus, premature greying of the hair and beard, soreness and weakness of the loins and the knees, abnormal uterine bleeding and excessive leukorrhea, general debility in chronic malaria, hyperlipemia.;Treatment of anemia, dizziness and tinnitus, premature greying of the hair and beard, soreness and weakness of the loins and the knees, abnormal uterine bleeding and excessive leukorrhea, general debility in chronic malaria, hyperlipemia.;;;For tonifying weakness;补虚;7133;872;HERB007036
177;TCMBANKHE003331;芫花条;stem of Lilac Daphne;YUAN HUA TIAO;Caulis Genkwa;"Warm; Pungent; Bitter";Lung; Large Intestine; Kidney;;;;Daphne genkwa Sieb. Et Zucc;Purging by pressure and by removing liquid;;Toxic;;Purging;泻下;4026;820;HERB006776
178;TCMBANKHE003336;炙蜂房;Prepared Honeycomb;ZHI FENG FANG;Nidus Vespae Preparata;"Mild; Sweet";Stomach;;;;;;"Polistes olivaceous (Degeer).;Polistes japonicus Saussure.;Parapolybia varia Fabricius.";Treatment of toothache due to caries, sores, ulcers, mastitis, scrofula, ringworm, tinea unguium.;Treatment of toothache due to caries, sores, ulcers, mastitis, scrofula, ringworm, tinea unguium.;Toxic;;Toxication reduction, anthelmintic, dampness removal, and itching control;解毒杀虫燥湿止痒;2819;847;HERB006988
179;TCMBANKHE003373;化橘红;Pummelo Peel;HUA JU HONG;Exocarpium Citri grandis;"Mild; Bitter";Liver;;;;;;;To dispel cold, eliminate damp and phlegm, and arrest emesis or nausea.;Treatment of cough, itching of the throat and profuse expectoration in colds, nausea, vomiting and epigastric distension caused by improper diet or excessive drinking.;;;Qi Regulating Drugs;理气药;7145;355;HERB002428
180;TCMBANKHE003386;薄荷脑;menthol;BO HE NAO;Mentholum;"Cool; Pungent";Lung; Liver;;;;;Metha haplocalyx Briq;As described under Peppermint Oil.;As described under Peppermint Oil.;;;;;3426;66;HERB000509
181;TCMBANKHE003403;岩盐;Halite;YAN YAN;Halitum;"Cold; Salty";Bladder; Heart; Kidney;;;;;Vomiting promotion;;;;Vomiting promotion;涌吐;8113;789;HERB006372
182;TCMBANKHE003426;茺蔚子;Motherwort Fruit;CHONG WEI ZI;Fructus Leonuri;"Minor cold; Sweet";Liver; Heart; Kidney;;;;;To activate blood circulation and regulate menstruation, to subdue hyperactivity of the liver, and to clear the eye of opacity.;Treatment of menstrual disorders, amenorrhea, hysmenorrhea, inflammation of the eye with formation of corneal opacity, dizziness and headache.;;;Blood Activating Stasis Removing Drugs;活血祛瘀药;1844;104;HERB000822
183;TCMBANKHE003433;白草霜;Powder of fumi carbonisatus;BAI CAO SHUANG;Pulvis Fumi Carbonisatus;"Warm; Pungent";Lung; Large Intestine; Stomach; Liver;;;;Constriction and bleeding control;;;;Bleeding control;止血;6219;15;HERB000163
184;TCMBANKHE003455;瓜篓皮;Snakegourd peel;GUA LOU PI;Pericarpium Trichosanthis;"Cold; Sweet; Slightly Bitter";Lung; Large Intestine; Stomach;;;;"Trichosanthes kirilowii Maxim.;Trichosanthes rosthornii Harms";Treatment of cough with yellowish sticky expectoration, oppressed feeling in the chest and costal pain.;Treatment of cough with yellowish sticky expectoration, oppressed feeling in the chest and costal pain.;;;For desolving phlegm, stopping cougth, and soothing breathing;化痰止咳平喘;2296;286;HERB001953
185;TCMBANKHE003458;青龙齿;;QING LONG CHI;;"Minor cold; Sweet; Punkery";Liver; Heart;;;;;;Supression and spirit calming;;;;Spirit calming;安神;5140;582;HERB004526
186;TCMBANKHE003468;煅磁石;Calcined Magnetite;DUAN CI SHI;Magnetitum Preparata;"Cold; Salty";Liver; Heart; Kidney;;;;;Treatment of dizziness, blurring of vision, tinnitus, impairment of hearing, palpitation, insomnia, dyspnea due to diminished function of the kidney.;Treatment of dizziness, blurring of vision, tinnitus, impairment of hearing, palpitation, insomnia, dyspnea due to diminished function of the kidney.;;;Spirit calming;安神;4916;226;HERB001420
187;TCMBANKHE003514;麻油;Sesame Oil;MA YOU;Oleum Sesami;"Cool; Sweet";Liver; Kidney;;;;;Sesamum indicum L.;For relaxing the bowels and moistening the lung when taken orally, also used as ground substance in making ointment and plaster for external application.;For relaxing the bowels and moistening the lung when taken orally, also used as ground substance in making ointment and plaster for external application.;;;;;1975;498;HERB003704
188;TCMBANKHE003524;余甘子;Emblic Leafflower Fruit;YU GAN ZI;Fructus Phyllanthi;"Cool; Sweet; Sour; Punkery";Lung; Stomach;;;;;;To remove heat from blood, to promote digestion and the production of body fluid, and to relieve cough.;Treatment of heat in the blood and blood stasis, liver and gall bladder diseases, dyspepsia, abdominal pain, cough, sore throat, dryness of the mouth.;;;Antipyretic Detoxicate Drugs;清热解毒药;5953;812;HERB006714
189;TCMBANKHE003531;蝼蛄;mole cricket;LOU GU;Gryllotalpa;"Cold; Salty";Bladder; Large Intestine; Small Intestine;;;;;For promoting diuresis and desolving inflammation;;;;For promoting diuresis and penetrating dampness;利水渗湿;3693;469;HERB003502
190;TCMBANKHE003580;银箔;Silver sheet;YIN BO;Silver sheet;"Cold; Pungent";Liver; Heart;;;;;;Supression and spirit calming;;Extremely Toxic;;Spirit calming;安神;7083;804;HERB006583
191;TCMBANKHE003614;橘红皮;Red Tangerine Peel;JU HONG PI;Exocarpium Citri Rubrum;"Warm; Pungent; Bitter";Lung; Spleen;;;;; Citrus reticulate Blanco and its cultivars;Treatment of cough, itching of the throat and profuse expectoration in colds, nausea, vomiting and epigastric distension caused by improper diet or excessive drinking.;Treatment of cough, itching of the throat and profuse expectoration in colds, nausea, vomiting and epigastric distension caused by improper diet or excessive drinking.;;;Regulation of qi;理气;4285;421;HERB003029
192;TCMBANKHE003619;玳瑁;Turtle;DAI MAO;Carapax Eretmochelydis;"Cold; Sweet; Salty";Liver; Heart;;;;;;For containing liver yang;;;;For calming liver and containing wind;平肝息风;1882;194;HERB001172
193;TCMBANKHE003622;淮山药;rhizome of Biglcaf Yam;HUAI SHAN YAO;Rhizoma Dioscoreae;"Mild; Sweet";Lung; Spleen; Kidney;;;;Dioscorea opposita Thunb;Treatment of anorexia and chronic diarrhea due to diminished function of the spleen , cough and dyspnea due to diminished function of the lung, seminal emission, excessive leukorrhea, frequency of urination or diabetes due to deficiency condition of the kidney.Rhizoma Dioscoreae (stir-fried with bran) Diminished function of the spleen with anorexia, diarrhea and excessive leukorrhea.;Its decoction (1:12800) can promote the phagocytosis of leukocyte in vitro.;;Its decoction (1:12800) can promote the phagocytosis of leukocyte in vitro.;For tonifying weakness;补虚;6838;362;HERB002476
194;TCMBANKHE003627;冬瓜仁;Seed of Chinese Waxgourd;DONG GUA REN;Semen Benincasae;"Minor cold; Sweet";Liver;;;;;;Benincasa hispida (Thunb.) Cogn;For promoting diuresis and desolving inflammation;;;;For promoting diuresis and penetrating dampness;利水渗湿;5264;224;HERB001356
195;TCMBANKHE003648;橘叶;tangerine leaf;JU YE;folium citri tangerie;"Mild; Pungent; Bitter";Liver;;;;;;;Regulation of qi;;;;Qi Regulating Drugs;理气药;2581;424;HERB003053
196;TCMBANKHE003672;竹沥;Bamboo juice;ZHU LI;Succus Bambusae;"Cold; Sweet";Lung; Liver; Heart;;;;;To clear heat and resolve phlegm;Treatment of: 1. Phlegm-heat cough manifested as cough with thick, yellow sputum and chest pain. Bamboo juice (Zhuli) is used with Loquat leaf (Pipaye) and Trichosanthes fruit (Gualou). 2. Windstroke due to heart misted by phlegm, epilepsy or manic psycho;;;Antipyretic Detoxicate Drugs;清热解毒药;3834;882;HERB007111
197;TCMBANKHE003681;草乌;Kusnezoff Monkshood Root;CAO WU;Radix Aconiti Kusnezoffii;"Hot; Pungent";Spleen; Heart; Kidney;;;;;To relieve rheumatic conditions, to warm the channels and to alleviate pain.;Treatment of rheumatic and rheumatoid arthralgia, precordial and abdominal pain with cold sensation, abdominal colic caused by cold, anaethesia.;Extremely Toxic;;Wind-Dampnessdispelling And Colddispersing Medicinal;祛风湿散寒药;1767;77;HERB000604
198;TCMBANKHE003687;制南星;Prepared Jackinthepulpit Tuber;ZHI NAN XING;Rhizoma Arisaematis Praeparata;"Warm; Pungent; Bitter";Lung; Spleen; Liver;;;;"Arisaema consanguineum Schott.; Arisaema amurense Maxim.;Arisaema heterophyllum Bl.";Treatment of intractable phlegm with cough, vertigo, stroke with phlegm in the throat, deviation of the eye and the mouth,and hemiplegia, epilepsy and convulsions, tetanus. External use of the crude drug for boils, sores, snake and insect bite.;Treatment of intractable phlegm with cough, vertigo, stroke with phlegm in the throat, deviation of the eye and the mouth,and hemiplegia, epilepsy and convulsions, tetanus. External use of the crude drug for boils, sores, snake and insect bite.;Extremely Toxic;;For desolving phlegm, stopping cougth, and soothing breathing;化痰止咳平喘;3291;863;HERB007024
199;TCMBANKHE003718;菊花;Chrysanthemum Flower;JU HUA;Flos Chrysanthemi;"Minor cold; Pungent; Sweet; Bitter";Lung; Liver;;;;;capitulum;To dispel wind-heat, to subdue hyperactivity of the liver, and improve eyesight.;Angina pectoris, hypertension, externally contracted wind-heat, wind warmth, fever and headache, dizziness, common cold, red eyes, red eyes with gall, swelling toxin of clove sore.;;1. Dilating coronary artery and increasing coronary flow in rabbits in vitro. 2. Sedative and antipyretic. ;Pungent Cool Diaphoretics;辛凉解表药;7682;422;HERB003031
200;TCMBANKHE003719;杭菊;Chrysanthemum Flower;HANG JU;Flos Chrysanthemi;"Minor cold; Sweet; Bitter";Lung; Liver; Kidney;;;;Chrysanthemum morifolium Ramat.;Treatment of wind-heat type common cold, headache and dizziness, inflammation of the eye, blurred vision.;Treatment of wind-heat type common cold, headache and dizziness, inflammation of the eye, blurred vision.;;;For relieving exterior syndrome;解表;7250;321;HERB002147
201;TCMBANKHE003720;积雪草;Asiatic Pennywort Herb;JI XUE CAO;herba centellae;"Warm; Slightly Sweet; Bitter";Liver;;;;;;whole herb with root;To remove heat and damp, to counteract toxicity, and to cause subsidence of swelling.;Sand qi abdominal pain, summerheat-heat diarrhea, dysentery, damp-heat jaundice, sand strangury, blood strangury, blood ejection, spontaneous external bleeding, red eyes, swollen throat, wind papules, scab and lichen, swelling toxin of clove welling abscess, knocks and falls, hypertension.;;;Antipyretic Detoxicate Drugs;清热解毒药;4738;383;HERB002713
202;TCMBANKHE003721;落得打;Asiatic Pennywort Herb;LUO DE DA;herba centellae;"Cold; Pungent; Bitter";Spleen; Liver; Kidney;;;;Centella asiatica (L.) Urb.;Treatment of jaundice caused by damp-heat, heat stroke with diarrhea, urolithiasis and hematuria, carbuncles and boils, traumatic injuries.;Treatment of jaundice caused by damp-heat, heat stroke with diarrhea, urolithiasis and hematuria, carbuncles and boils, traumatic injuries.;;;Blood activation and stasis removal;活血化淤;4455;483;HERB003574
203;TCMBANKHE003722;双花;Honeysuckle Flower;SHUANG HUA;Flos Lonicerae;"Cold; Sweet";Lung; Spleen; Stomach; Heart;;;"Lonicera japonica Thunb.;Lonicera hypoglauca Miq.;Lonicera confuse DC.;Lonicera dasystyla Rehd.";Treatment of carbuncles, boils, erysipelas, acute dysentery, pharyngitis, upper respiratory infection, epidemic febrile diseases.;1. Broad-spectrum antibiotic , chlorogenic acid, isochlorogenic acid and luteolin are the major active components2. Anti-inflammatory, 0.25g/kg intraperitoneally in mice.3. Antipyretic.4. Its aqueous distillate (1:1280) promotes white cell phagocytosis and enhances lymphocyte-blastogenesis rate in vitro.;;1. Broad-spectrum antibiotic , chlorogenic acid, isochlorogenic acid and luteolin are the major active components2. Anti-inflammatory, 0.25g/kg intraperitoneally in mice.3. Antipyretic.4. Its aqueous distillate (1:1280) promotes white cell phagocytosis an;Heat clearence;清热;5938;667;HERB005150
204;TCMBANKHE003723;金银花;Honeysuckle Flower;JIN YIN HUA;Flos Lonicerae;"Cold; Sweet";Lung; Stomach; Heart;;;;flower bud;To remove toxic heat and dispel wind-heat.;Infection of upper respiratory tract, tonsillitis, acute laryngitis, skin suppurations, welling abscess, viral conjunctivitis, influenza, pneumonia, mastitis, acute appendicitis, warm disease fever, heat toxin blood dysentery, swollen welling abscess and clove sores, throat impediment.;;1. Broad-spectrum antibiotic , chlorogenic acid, isochlorogenic acid and luteolin are the major active components2. Anti-inflammatory, 0.25g/kg intraperitoneally in mice.3. Antipyretic.4. Its aqueous distillate (1:1280) promotes white cell phagocytosis an;Antipyretic Detoxicate Drugs;清热解毒药;2475;409;HERB002962
205;TCMBANKHE003724;姜黄;rhizome of Common Turmeric;JIANG HUANG;Rhizoma Curcumae longae;"Warm; Pungent; Bitter";Spleen; Liver;;;;;tuberoid;To eliminate blood stasis, promote the flow of qi, stimulate menstrual discharge and relieve pain.;Gallstones, jaundice, leukaemia in early stage and carcinoma of uterine cervix in early stage, chronic ulcer, chronic scab, blood stasis and qi stagnation, pain in chest and abdomen and rib-side, dysmenorrhea, amenorrhea, postpartum stasis stagnation abdominal pain, wind-heat impediment pain, knocks and falls, swollen welling abscess.;;;Blood Activating Stasis Removing Drugs;活血祛瘀药;6033;389;HERB002840
206;TCMBANKHE003725;生姜;Fresh Ginger;SHENG JIANG;Rhizoma Zingiberis Recens;"Warm; Pungent";Lung; Spleen; Stomach;;;;fresh rhizome;To induce perspiration and dispel cold, to warm the stomach and arret vomiting, and to resolve phlegm and relieve cough.;Wind-cold common cold, fever and aversion to wind, headache and nasal congestion, vomiting, phlegm-rheum cough asthma, distention fullness, diarrhea.;;1. Oral administration can stimulate the buccal mucosa and gastric mucosa, and accelerate the secretion of digestive juice, so as to promote appetite.2. Relieving unusal intestinal fermentation and promoting the gas exhaustion from intestine.3. The mixtur;Pungent-Warm Exterior-Releasing Medicinal;辛温解表药;7484;640;HERB005017
207;TCMBANKHE003726;肉桂;Cassia Bark;ROU GUI;Cortex Cinmomi;"Hot; Pungent; Sweet";Spleen; Liver; Heart; Kidney;;;bark;To supplement body fire, reinforce yang, and lead the fire back to the kidney, to dispel cold and relieve pain, and to activate blood circulation and stimulate menstrual discharge.;Impotence, uterus cold, cold pain in lumbus and knees, kidney vacuity asthma, yang vacuity dizziness, red eyes and sore pharynx, cold pain in heart and abdomen, vacuity cold vomiting and diarrhea, cold mounting, running piglet, amenorrhea, dysmenorrhea.;;Its volatile oil contains cinnamic aldehyde, cinnamic acid and cinnamyl acetate, can promote saliva secretion and digestion, and exert an antispasmodic effect on smooth muscles of internal organs.;Warming Interior Drugs;温里药;7524;598;HERB004694
208;TCMBANKHE003727;甘蓝;Cabbage;GAN LAN;Brassica oleracea var. capitata;"Mild; Sweet; Sour; Punkery";Lung;;;;;;leaf;To clear heat and disinhibit damp, dissipate binds and relieve pain, boost kidney and supplement vacuity.;Damp-heat jaundice, pain from ulcer in digestive tract, stiffness in joints, vacuity detriment.;;;Heat clearence;清热;7049;261;HERB001788
209;TCMBANKHE003728;甘草;Root of Ural Licorice;GAN CAO;Radix Glycyrrhizae;"Mild; Sweet";Lung; Spleen; Stomach; Heart;;;root and rhizome;To reinforce the function of the spleen and replenish qi, to remove heat and counteract toxicity, to dispel phlegm and relieve cough, to alleviate spasmodic pain, and to moderate drug actions.;1. Its decoction can inhibit intestinal smooth muscles of rabbins in vitro, but glycyrrhizin and glycyrrhetinic acid have no this effect.2. Possessing an adrenocorticomimetic effect.3. Its extract and glycyrrhizin exerts a detoxifying effect.4. Antitussive and antiasthmatic. 5. Glycyrrhizin has anti-inflammatory effect similar to hydrocortisone.;;1. Its decoction can inhibit intestinal smooth muscles of rabbins in vitro, but glycyrrhizin and glycyrrhetinic acid have no this effect.2. Possessing an adrenocorticomimetic effect.3. Its extract and glycyrrhizin exerts a detoxifying effect.4. Antitussiv;Qi Reinforcing Drugs;补气药;6801;258;HERB001779
210;TCMBANKHE003729;小甘草;Root of Ural Licorice;XIAO GAN CAO;Radix Glycyrrhizae;"Mild; Sweet";Lung; Spleen; Stomach; Heart;;;"Glycyrrhiza uralensis Fisch; Glycyrrhiza inflate Bat.;Glycyrrhiza glabra L.";Treatment of weakness of the spleen and the stomach marked by lassitude and weakness, cardiac palpitation and shortness of breath, cough with much phlegm , spasmodic pain in the epigastrium, abdomen and limbs, carbuncles and sores. It is often used for reducing the toxic or drastic actions of other drugs.Radix Glycyrrhizae (processed with honey) Weakness of the spleen and the stomach with lassitude and lack of strength, arrhythmia.;1. Its decoction can inhibit intestinal smooth muscles of rabbins in vitro, but glycyrrhizin and glycyrrhetinic acid have no this effect.2. Possessing an adrenocorticomimetic effect.3. Its extract and glycyrrhizin exerts a detoxifying effect.4. Antitussive and antiasthmatic. 5. Glycyrrhizin has anti-inflammatory effect similar to hydrocortisone.;;1. Its decoction can inhibit intestinal smooth muscles of rabbins in vitro, but glycyrrhizin and glycyrrhetinic acid have no this effect.2. Possessing an adrenocorticomimetic effect.3. Its extract and glycyrrhizin exerts a detoxifying effect.4. Antitussiv;For tonifying weakness;补虚;5791;762;HERB006082
211;TCMBANKHE003734;雷公藤;root of common htreewingnut;LEI GONG TENG;radix tripterygii wilfordii;"Cold; Bitter";Liver; Heart;;;;;root, leaf and flower;To expel wind-dampness, relieve swelling, alleviate pain and dredge the meridian passage.;Rheumatoid arthritis, rheumatic arthritis, glomerulonephritis, nephropathy syndrome, erythematous lupus, dryness in eyes and mouth, Behcet’s syndrome, psoriasis, eczema, leprosy, scab sore, intractable lichen.;Slightly Toxic;1. The decoction of its root cortex lowers blood pressure, slows heart rate and prolongs the P-R period in ECG. 2. Its active components, triptolide and tripdiolide (0.1mg/kg), inhibits leukemia1210 in mice. 3. Its alkaloids inhibit the experimental arthr;Wind-Dampnessdispelling And Colddispersing Medicinal;祛风湿散寒药;4393;441;HERB003288
212;TCMBANKHE003735;鱼腥草;all-grass of Heartleaf Houttuynia;YU XING CAO;Herba Houttuyniae;"Minor cold; Pungent";Lung;;;;;;aerial parts;To remove toxic heat, to promote the drainage of pus, and to relieve dysuria.;Pulmonary welling abscess with hacking of pus and blood, lung heat phlegm cough, pneumonia, chronic bronchitis, urinary tract infection, odynuria, chronic uterine cervical infection, leptospirosis, otitis media, cystitis, dysentery, mastitis, heat toxin sores, heat strangury.;;1. Decanoyl acetaldehyde is bacteriostatic and fungistatic. 2. Its decoction retards the progress of tuberculosis experimentally.  3. Synthetic product ( compound of decanoyl acetaldehyde and NaHSO3 ) promotes white cell phagocytosis. 4. Anti-inflammation;Antipyretic Detoxicate Drugs;清热解毒药;3847;815;HERB006741
